{
    "$schema": "urn:pickle:schemas:artefacts:domains:data:conceptual:DAT-DAC",
    "audience": [
        "Enterprise Architect",
        "Data Architect",
        "Chief Data Officer"
    ],
    "author": [
        "Data Architect",
        "Data Analyst"
    ],
    "domains": [
        {
            "id": "DAT-DOM-CUSTOMER",
            "name": "Customer",
            "description": "Customers, accounts, contracts, premises, and customer interactions.",
            "owner": "Chief Customer Officer"
        },
        {
            "id": "DAT-DOM-ASSET",
            "name": "Asset",
            "description": "Physical assets across the treatment, distribution, collection and back-office estate.",
            "owner": "Head of Asset Management"
        },
        {
            "id": "DAT-DOM-GENERATION",
            "name": "Treatment",
            "description": "Treatment units, production output, treatment chemical, and emissions associated with water production.",
            "owner": "Head of Treatment"
        },
        {
            "id": "DAT-DOM-NETWORK",
            "name": "Network",
            "description": "Network topology, capacity, flows, and connection points.",
            "owner": "Head of Network Operations"
        },
        {
            "id": "DAT-DOM-MARKET",
            "name": "Market & Wholesale",
            "description": "Market data, trade positions, counterparties, and settlements.",
            "owner": "Head of Wholesale"
        },
        {
            "id": "DAT-DOM-METER",
            "name": "Metering",
            "description": "Meters, meter reads, consumption data, and metering points.",
            "owner": "Head of Metering"
        },
        {
            "id": "DAT-DOM-BILLING",
            "name": "Billing & Payment",
            "description": "Tariffs, bills, payments, and arrears.",
            "owner": "Head of Retail Operations"
        },
        {
            "id": "DAT-DOM-REGULATORY",
            "name": "Regulatory & Compliance",
            "description": "Licences, regulatory obligations, and compliance reporting.",
            "owner": "Head of Regulatory Affairs"
        },
        {
            "id": "DAT-DOM-SUSTAINABILITY",
            "name": "Sustainability",
            "description": "Emissions, low-carbon sources, carbon credits, and ESG disclosures.",
            "owner": "Chief Sustainability Officer"
        },
        {
            "id": "DAT-DOM-WORKFORCE",
            "name": "Workforce",
            "description": "Employees, contractors, skills, and field-work assignments.",
            "owner": "Chief People Officer"
        },
        {
            "id": "DAT-DOM-FINANCE",
            "name": "Finance",
            "description": "General ledger, cost centres, suppliers, and financial close.",
            "owner": "Chief Financial Officer"
        }
    ],
    "concepts": [
        {
            "id": "CON-CUSTOMER",
            "name": "Customer",
            "description": "A residential, business, or industrial customer purchasing water.",
            "domain-id": "DAT-DOM-CUSTOMER",
            "type": "entity",
            "classification": "confidential",
            "aliases": [
                "Account holder",
                "Client"
            ]
        },
        {
            "id": "CON-ACCOUNT",
            "name": "Account",
            "description": "A billing relationship between the company and a customer.",
            "domain-id": "DAT-DOM-CUSTOMER",
            "type": "entity",
            "classification": "confidential"
        },
        {
            "id": "CON-CONTRACT",
            "name": "Contract",
            "description": "A signed agreement on tariff, term, and product between customer and supplier.",
            "domain-id": "DAT-DOM-CUSTOMER",
            "type": "entity",
            "classification": "confidential"
        },
        {
            "id": "CON-PREMISE",
            "name": "Premise",
            "description": "A physical location at which water is supplied (the site identifier).",
            "domain-id": "DAT-DOM-CUSTOMER",
            "type": "entity",
            "classification": "confidential",
            "aliases": [
                "Supply Point",
                "Site"
            ]
        },
        {
            "id": "CON-CUST-INTERACTION",
            "name": "Customer Interaction",
            "description": "A discrete contact with a customer across any channel.",
            "domain-id": "DAT-DOM-CUSTOMER",
            "type": "event",
            "classification": "confidential"
        },
        {
            "id": "CON-ASSET",
            "name": "Asset",
            "description": "A managed physical asset (e.g. transformer, generator, vehicle).",
            "domain-id": "DAT-DOM-ASSET",
            "type": "entity",
            "classification": "internal"
        },
        {
            "id": "CON-ASSET-TYPE",
            "name": "Asset Type",
            "description": "A class of asset with shared characteristics (taxonomy reference data).",
            "domain-id": "DAT-DOM-ASSET",
            "type": "reference",
            "classification": "public"
        },
        {
            "id": "CON-ASSET-CONDITION",
            "name": "Asset Condition",
            "description": "A point-in-time assessment of an asset's condition.",
            "domain-id": "DAT-DOM-ASSET",
            "type": "event",
            "classification": "internal"
        },
        {
            "id": "CON-MAINT-WORK-ORDER",
            "name": "Maintenance Work Order",
            "description": "A request to perform maintenance on an asset.",
            "domain-id": "DAT-DOM-ASSET",
            "type": "entity",
            "classification": "internal"
        },
        {
            "id": "CON-GEN-UNIT",
            "name": "Treatment Stream",
            "description": "An individually-controllable treatment stream within a works.",
            "domain-id": "DAT-DOM-GENERATION",
            "type": "entity",
            "classification": "internal"
        },
        {
            "id": "CON-PRODUCTION-OUTPUT",
            "name": "Production Output",
            "description": "Water produced by a unit over a reporting interval.",
            "domain-id": "DAT-DOM-GENERATION",
            "type": "event",
            "classification": "internal"
        },
        {
            "id": "CON-FUEL-CONSUMPTION",
            "name": "Chemical Consumption",
            "description": "Treatment chemical consumed by a treatment stream over a reporting interval.",
            "domain-id": "DAT-DOM-GENERATION",
            "type": "event",
            "classification": "internal"
        },
        {
            "id": "CON-GEN-OUTAGE",
            "name": "Treatment Outage",
            "description": "A planned or unplanned outage of a treatment stream.",
            "domain-id": "DAT-DOM-GENERATION",
            "type": "event",
            "classification": "internal"
        },
        {
            "id": "CON-NETWORK-NODE",
            "name": "Network Node",
            "description": "A node in the bulk transfer or distribution network topology.",
            "domain-id": "DAT-DOM-NETWORK",
            "type": "entity",
            "classification": "internal"
        },
        {
            "id": "CON-CONNECTION-POINT",
            "name": "Connection Point",
            "description": "Point at which a customer, generator or interconnector connects to the network.",
            "domain-id": "DAT-DOM-NETWORK",
            "type": "entity",
            "classification": "internal"
        },
        {
            "id": "CON-NETWORK-CAPACITY",
            "name": "Network Capacity",
            "description": "Available capacity for a network element or path.",
            "domain-id": "DAT-DOM-NETWORK",
            "type": "entity",
            "classification": "internal"
        },
        {
            "id": "CON-POWER-FLOW",
            "name": "Power Flow",
            "description": "Measured or estimated power flow across a network element.",
            "domain-id": "DAT-DOM-NETWORK",
            "type": "event",
            "classification": "internal"
        },
        {
            "id": "CON-NETWORK-OUTAGE",
            "name": "Network Outage",
            "description": "A planned or unplanned outage of a network element.",
            "domain-id": "DAT-DOM-NETWORK",
            "type": "event",
            "classification": "internal"
        },
        {
            "id": "CON-MARKET-PRICE",
            "name": "Market Price",
            "description": "A published or transacted price for an water product on a market.",
            "domain-id": "DAT-DOM-MARKET",
            "type": "event",
            "classification": "internal"
        },
        {
            "id": "CON-TRADE",
            "name": "Trade",
            "description": "An individual trade between counterparties.",
            "domain-id": "DAT-DOM-MARKET",
            "type": "entity",
            "classification": "confidential"
        },
        {
            "id": "CON-POSITION",
            "name": "Position",
            "description": "Net exposure across products and tenors, derived from trades.",
            "domain-id": "DAT-DOM-MARKET",
            "type": "entity",
            "classification": "confidential"
        },
        {
            "id": "CON-COUNTERPARTY",
            "name": "Counterparty",
            "description": "A market counterparty to a trade or contract.",
            "domain-id": "DAT-DOM-MARKET",
            "type": "entity",
            "classification": "confidential"
        },
        {
            "id": "CON-SETTLEMENT",
            "name": "Settlement",
            "description": "Financial and physical settlement of a trade or market position.",
            "domain-id": "DAT-DOM-MARKET",
            "type": "event",